context,wrong,right
"Disinggung pemain yang akan diturunkan pada laga esok, Milo mengatakan bahwa kemungkinan tidak akan banyak mengalami perubahan dengan skuad menghadi Gresik United.",menghadi,menghadapi
"Di sini masyarakat langsung beranggapan bahwa itulah gambaran sesusungguhnya dari hidup yang saya jalani selama ini,"" kata perempuan yang pernah menyabet Penghargaan Televisi Nasional untuk Newcomer, British Soap Award untuk Best Young Performance.",sesusungguhnya,sesungguhnya
"""Ini mengingat nilai luhur atau tujuan nawa cita yang menjadi landasan pementahan Jokowi-Jk tidak boleh diciderai atau digadaikan.",pementahan,pemerintahan
Kerugian diperkirakanan Rp 75 ribu.,diperkirakanan,diperkirakan
"Sementara militer membantu dalam menemukan polisi yang tewas, personel polisi melancarkan operasi terhadap anasi pelanggar hukum dan melaksanakan surat penangkapan, Padilla menambahkan, sebagaimana diberitakan Xinhua.",anasi,anak
"Lengserkeun Si Aceng teh (turunkan jabatannya),"" seru salah seorang pendemo yang antusias mengikuti perkembangan jalannya paripurna oleh DPRD Garut, Rabu sore.",Lengserkeun,Lengserkan
"""Upaya meningkatkan profesioanlisme serta mtingkatkan tata kelola pemerintahan sudah lebih baik,"" katanya.",mtingkatkan,meningkatkan
"Teguh menjelaskan, nantinya ada tim yang akan mendatangi warga untuk memastikan kesusaian data dengan kenyataan di lapangan.",kesusaian,kesesuaian
"""Inflasi Maret (0,27--0,3 persen) itu tingginya dibatas wajar,"" ujarnya ditemui di Kompleks Perkantor BI jakarta.",Perkantor,Perkantoran
Barcelona terganjal ke kuasrter-final Liga Champions setelah kalah agregat 2-3 oleh Atletico.,kuasrter-final,quarter-final
"Menurut Polisi, saat akan dilakukan penggeledahan, terdakwa mengambil tas miliknya dimana di dalamnya berisi tiga botol permen karet xilytol dan menggegamnya dengan erat-erat.",xilytol,xylitol
"Dengan adanya kesanggupan Pemerintrah daerah atau Provinsi menyediakan anggran untuk bonus atlet, Yayuk melihat masalah dana sebenarnya bisa diatasi.",Pemerintrah,Pmerintah
"Berkaitan dengan hal itu, Balai Besar TNGGP mempertimbangkan melegalkan jalur-lajur pendakian ekstrem untuk para petualang dan pencita alam sejati yang memang sudah memiliki ilmu, pengetahuan, dan pengalaman cukup dalam mendaki gunung dan menaklukan alam liar.",jalur-lajur,jalur-jalur
"Karena fleksibility harga menjadi sangat tinggi, ini tidak menguntungkan, karena tidak ada standar.",fleksibility,fleksibilitas
"""Faktor di dalam negeri yang mempengaruhi penguatan rupaih, salah satunya pengaruh positif dari kebijakan yang dikeluarkan oleh Otoritas Jasa Keuangan (OJK),"" kata Achmad Deni Daruri, President Director Center for Banking Crisis, dalam keterangan persnya di Jakarta, Senin.",rupaih,rupiah
"Dia mengatakan bahwa ICC sendiri tidak memiliki juridiksi terhadap Presiden Bashir, karena Sudan tidak menandatanganni Statuta Roma.",juridiksi,yurisdiksi
"Mandela menjalani hari keempatbelasnya di RS Praetoria, Kamis, dengan kondisi serius karena infeksi paru-paru.",keempatbelasnya,keempatbelasannya
"Sumber itu menambahkan, Presiden setelah itu akan bertemu dengan admintrator United Nation Development Program (UNDP) Helen Clark dan perwakilan UNEP, Achim Steiner.",admintrator,administrator
"Mereka kembali membentuk barisan di depan gerbang DPR sambil menyerukan 'Polisi Pembunuh, dan menyanyiak lagu-lagu perjuangan.",menyanyiak,menyanyikan
"Nusa Dua (ANTARA News) -  Ketua Umum Artai Golkar Aburizal Bakrie yang akrab disapa Ical menegaskan, tak merasa  kantor DPP Golkar di Slipi itu diduduki oleh Tim Penyelamat Partai Golkar.",Artai,Partai
"""Saya dan asisten saya, Stephanie mengambil polaroid dan memotret seisisi rumah.",seisisi,seisi
Dia berharap pemerintah serius dalam mengajukan darft revisi UU Perlindungan Anak itu.,darft,draft
"Sadikin menilai penyebab irigasi tersebut tidak bisa difungsikan, karena saat dibangun salah dalam perencanaan awal, yakni saluran irgiasi yang seyogianya untuk mengairi air ke sawah, malah membuat areal persawahan bertambah kering, akibat salurannya lebih rendah dari sawah.",irgiasi,irigasi
"Di Kabutaen Boven Digul, kata Teguh, pada Jumat pekan kemarin juga menggelar kegiatan yang sama, yakni  menindak lanjuti upaya peningkatan ketahanan pangan di Papua dan Papua Barat yang dicanangkan oleh Presiden Joko Widodo.",Kabutaen,Kabupaten
"Arka menjelaskan, jumlah wilayah akan didasarkan pada kemanpuan teknis dan kemampuan adimistratif yang ada.",adimistratif,administratif
"Saya yakin fisik lelah akan hilang terhapus saat melihat indahnya paronama negeri ini,"" kata Harry.",paronama,panorama
"Ke-1000 personel yang dikerahkan, terdiri atas 240 persenonel dari Polda, Kepolisian Kota Besar Yogyakarta (110), Kepolisian Resor Sleman (100), Bantul (390), serta Gunung Kidul dan Kulon Progo masing-masing 80.",persenonel,personel
"Para pengnujuk rasa membawa plaat-plakat bertuliskan ""Putin, ke luar dari Ukraina"" dan lain-lainnya yang menyebut tindakan Rusia di Krimea sama dengan aneksasi Sudetentaland leh Nazi saat Eropa masuk Perang Dunia II.",pengnujuk,pengunjuk
"Dalam pernyataan bersama dengan Ahmad Jarba, pemimpin Koalisi Nasional Suriah (SNC) --kelompok payung oposisi yang berpusat di Istanbul, Davutgolu mengatakan, ""Perwakilan kuat rakyat Suriah di Jenewa II adalah keinginan terbesar Turki.",Davutgolu,Davutoglu
"""Karya seni Nona Minaj untuk single-nya itu tidak menggambarkan kesejatian warisan Malcolm X,"" kata anak perempuan Malcolm X, Ilyasah Shabazz, Jumat pekan lalu, seperti dikutip Rollling Stone.",Rollling,rolling
"Dalam selebaran itu, kata Doddy Sastra, dipertanyakan siapakah Bunda Putri yang namanya disebut mantan Presiden PKS Luhtfi Hasan Ishaq dalam persidangannya beberapa waktu lalu.",Luhtfi,Luthfi
"""Sebagian besar warga negara Filipina, dapat mengerti Bahasa Indonesia, tetapi sebagian warga negara Indonesia tidak dapat ber-Bahasa Inggris,"" ungkap juru bicara tersebut.",ber-Bahasa,berbahasa
"""Dengan asumsi MH370 Malaysia Airlines itu kehabisan bahan bakar setelah dimelencengkan ke sana-sini di luar  oleh pihak pengendali MH370 itu, pencarian di perairan dilakukan juga dari udara dan ruang angkasa.",dimelencengkan,dilencengkan
Belum ada pihak yang mengaku bertanggung jawab atas seragnan itu.,seragnan,serangan
"""Harus dibenahi selain dari sisi regulasi, harus ada pembenahanan dari sisi aktor-aktornya juga, DPD, DPR, ataupun parpol,"" kata dia.",pembenahanan,pembenahan
Lalu bagaimanana ciri-ciri Arun?,bagaimanana,bagaimana
"Minggu malam lalu, diplomat senior AS Brett McGurk mempositng foto dirinya menyambut Rezaian begitu mendarat di bandara Jenewa.",mempositng,memposting
Topan yang berlangsung sepekan itu juga menerjang Pulua Luzon.,Pulua,Pulau
"Kini, masyarakat di desa dan kecamatan terpencil di Sumba Timur mengonsumsi  iwi   sejenis ubi hutan yang beracun.",mengonsums,mengkonsumsi
"Dengan begitu ujarnya, maka keuntungan dari inevstasi di Bursa Efek Indonesia akan lebih banyak dinikmati oleh masyarakat Indonesia sendiri.",inevstasi,investasi
"""Kami telah berkoordinasi dengan Dinas Kelautan, Perikanan, dan Pernakan (Kepenak) supaya seluruh unggas, baik itu piaraan maupun ternak, harus mendapatkan vaksin,"" katanya.",Pernakan,Peternakan
"Malang (ANTARA News) - Lima mahasiswa Fakultas Teknologi Pertanian Universitas Brawijaya (UB) Malang, Jawa Timur, menciptakan detergen berbahan baku ekstrak getah biduri atau calotropis gigantae dengan teknologi nano, yakni ""Bio-Nano Surf"".",gigantae,gigantea
"""Kami berharap ke-8 majelis hakim MK yang ada dapat tetap menjalankan tugas-tugas konstitusionalnya dan segera mengembalikan krebilitas MK di mata publik dengan mengambil langkah konkrit, seperti membentuk Majelis Kehormatan"" tandasnya.",krebilitas,kredibilitas
"Sementara itu, manajer Dortmund Thomas Tuchel melihat bahwa Liga Eropa merupakan prirotas tim yang ia latih dalam musim ini.",prirotas,prioritas
"Karena itu, dia mengimbau para lulusan SMA yang masih ragu-ragu menentukan pilihan program studi di perguruan tinggi, untuk merokemendasikan memilih jurusan jurusan Teknik Ekonomi Konstruksi yang satu-satunya ada di UBH Padang.",merokemendasikan,merekomendasikan
"Tidak ada orang yang mencurigakan walaupun terjadi antrean.- Usahakan saat bertransaksi tak ada orang yang menemani, termasuk orang dekat Anda.- Saat memasukkan PIN, tutup tombol angka dengan tangan atau badan.- Jika melakukan transaksi transfer dan pembayaran, pastikan semua data benar.- Simpan atau robek sekecil mungkin struk ATM.- Usahakan melakukan transaksi di ATM yang berada di lokasi aman.- Jangan panik jika terjadi gangguan saat bertransaksi di ATM.",ATM.-,ATM
"Menurut Ruben, para pelajar akan dibekali pemahaman ""Kodu Game Lab"", yakni sebuah bahasa programan yang cenderung mudah dipelajari dan digunakan oleh pembuat aplikasi pemula.",programan,program
"""Kami minta agar Pemerintah RI bersipak agar mampu melaksanakan politik luar negeri bebas aktif, mendesak Perserikatan Bangsa-Bansa (PBB) untuk perdamaian dunia dan bersikap independen dalam penyelesaian konflik Palestina-Israel,"" tuturnya.",bersipak,bersikap
"CO. ID, JAKARTA -- Pakar Hukum Tata Negara Universitas Parahyangan, Asep Warlan Yusuf mengatakan jika keinginanan SBY untuk mendukung pilkada langsung benar-benar konsisten dan serius.",keinginanan,keinginan
"""Kami memang sudah merencanakan untuk bertemu dengan Direktur Jenderal Kekayaan Negara Depeku Hadianto untuk mengadakan pertemuan, minggu depan.",Depeku,Depkeu
"""Investor sendiri memandang Jokowi karena dia figur yang reformatif dan -nya pun cepat, dilihat dari kepimpinannya di Jakarta sudah terlihat bahwa dia cepat dalam mengambil langkah, ini yang diinginkan investor,"" paparnya.",kepimpinannya,kepemimpinannya
Baca juga:Bagaimana Mungkin Menpora Tak Tahu Penyimpangan Hambalang?BPK Dalami Aliran Dana di Proyek HambalangBPK Telusuri Keterlbatan Politisi di HambalangBerita terkait juga dapat diikuti dalam topik:Skandal Proyek HambalangAudit Investigasi Hambalang,Keterlbatan,Keterlambatan
"Menunggangi kuda bernama Rimo, Jojo hanya mencatat total pe nalti sebanyak 64,59 persen dari tiga nomor lomba.",nalti,penalti
"""Mercusuar akan dibangun di Lereklerakang karena selat Makassar merupakan alur laut kepulauan Indonesia (Alki) II, yang ramai dilalui kapal yang melakukan pelayaran internasional,"" katanya.",Lereklerakang,Lerelerekang
"Mereka sebelumnya beunjuk rasa di depan Istana Merdeka, menuntut hak atas tanah dan reformasi undang-undang agraria.",beunjuk,bertunjuk
"Herman menyebutkan sesuai hasil qurah pemondokan jamaah haji Aceh wilayah Makkah yang digelar di Jakarta, kloter pertama akan menempati Maktab 42, Rumah 623, Sektor V, Kapasitas 394 di wilayah Syisyah.",qurah,Qur'ah
Warga Pekon Karang Agung yang jumlahnya skitar 500 orang datang ke TKP dan langsung membakar rumah sodara japon (pengepul hasil bumi lada).,sodara,saudara
"""Ya hanya Seladi, sela-selane dadi,"" katanya kemudian tertawa lebar.",sela-selane,sela-sela
"Maka, dengan jumlah luas lahan sebagaimana dikatakakan di atas, kesempatan berinvestasi di situ masih terbuka lebar.",dikatakakan,dikatakan
"Satelit Terra Aqua, kata dia, mendeteksi 471 hotspot di Sumatera dan 398 hotpsot di Kalimantan pada Jumat.",hotpsot,hotspot
Tsunami yang diakibatkan oleh letsuan Krakatau ini merupakan salah satu yang terbesar yang diakibatkan oleh letusan gunung api.,letsuan,letusan
"Dalam pemeriksaan lebih menyeluruh di rumah sakit Ng Teng Fong, dokter menyatakan ia harus beritsirahat total dan menjalani perawatan di ruamh sakit.",beritsirahat,beristirahat
"Guna mengantisipasasi penipuan berkedok umrah, Kemenag tengah berkoordinasi dengan Kanwil Kemenag Jateng dan Bupati Semarang.",mengantisipasasi,mengantisipasi
"Dengan diperkenalkanya batik sejak dini, ketika lulus, siswa diharapkan bisa mengetahui filosofi batik serta mampu membuatnya sehingga siswa lulusan Yogyakarta memiliki kekekhasan dibandingkan siswa lainnya.",kekekhasan,kekhasan
"""Memberantas narkoba itu kaya fenemona gunung es.",fenemona,fenomena
"Penawaran untuk seri ini mnecapai lebih dari Rp2,14 triliun dengan imbal hasil tertinggi masuk 7,0 persen dan terendah 6,40 persen.",mnecapai,mencapai
"Ia mengatakan, pembebabasan harus dihargai selama itu sesuai dengan aturan main undang-undang.",pembebabasan,pembebasan
"Walau begitu, dalam sepengetahuannya, buku-buku itu memang sudah dididaftarkan untuk uji kelayakan, meski belum dinyatakan layak edar oleh Puskurbuk.",dididaftarkan,didaftarkan
"Sikap PBB, lanjut Wibowo, terkait kenaikanan harga BBM, menolak opsi dua harga.",kenaikanan,kenaikan
Anggaran negara untuk sertifikasi guru ini semnagatnya untuk meningkatkan kinerja dan kesejahteraan guur.,semnagatnya,semangatnya
Aliansi Warga Anti Krminalisasi (AWAK ) KPK menggalang tandatangan dukungan terhadap kedua tokoh tersebut.,Krminalisasi,kriminalisasi
Gubernur Anwar Adnan Saleh misalnya ketika berdialog dengan ribuan massa pendukung Obed malah menuding media jadi provokator karena memberitakan soal putusna MA.,putusna,putusan
Pesawat ini adalah rancangan terbaru militer Iran sejak meluncurkan pesawat Azarakh atau Kilat pada 2007.,Azarakh,Azarakhsh
"""Kota ini sudah membutuhkan sumur injeksi yang jumlahnya tidak sedikit untuk menampung pelimpasan air hujan agar tidak sampai terjadi banjir.",pelimpasan,limpasan
"""Bapak, maaf, karena memang kami tidak bisa meng-cancel meeting.",meng-cancel,mencancel
"SURABAYA, KOMPAS.com - Pengoperasian Jembatan Suramadu tinggal beberapa pekan lagi.",mbatan,Jembatan
"Sementara bibit badai tropsi yang tumbuh di sekitar laut Arafuru atau sekitar utara Darwin tidak berkembang menjadi badai, sebagai penggantinya muncul  badai tropis ""June"" disekitar New Caledonia atau sebelah selatan Negara Fiji.",tropsi,tropis
"Tapi kalau sudah mengajak propaganda, demosntrasi itu jadi persoalan lain,"" katanya.",demosntrasi,demonstrasi
"Misalnya pada bagian asrama putera yang dibangun sejak tahun 1994, tidak berfungsi lagi karena sebagian besar bangunannya rusak dan bocor tetapi tidak pernah direnovasi Dinas Pendidikan dan Kebuadyaan Provinsi Maluku.",Kebuadyaan,Kebudayaan
"Dapat diinstal di sistem operasi Windows 7 dan Windows 8, Documal terintegarsi dengan email, sehingga memudahkan pengguna untuk berbagi informasi.",terintegarsi,terintegrasi
"Atletico dapat menjadi ancaman bagi Messi dan kawan-kawasan karena dalam enam pertandingan terakhir, Atletico mencatat dua kali seri dan empat kali menang.",kawan-kawasan,kawasan-kawasan
"Oleh sebab itu, peemrintahan Jokowi dapat memperhatikan pembangunan JSS yang sudah masuk proyek nasional bisa direalisasikannya.",peemrintahan,pemerintahan
Hanya saja tidak ada gol tercipat hingga babak pertama usai.,tercipat,tercipta
"Unggulan ketujuh Wozniacki melaju di Brisbane setelah pertarungan putaran pertama yang sengit dengan petenis kualifikasi Kazakhstan ksenia Pervak, sehingga ia kehilangan waktu-waktu latihan sebelum bermain di Australia Terbuka.",ksenia,kesenian
"Ia yakin benar bahwa Gaurdiola merupakan salah satu ""pelatih terbaik di kolong langit ini"".",Gaurdiola,Guardiola
Sollahuddin Wahid4.,Sollahuddin,Salahuddin
"Meski sudah ditertibkan, tak jarang para PKL ini kembali lagi berjulanan di jalan.",berjulanan,berjualan
Jakarta (ANTARA News) - Priden Susilo Bambang Yudhoyono melalui akun twitternya memberikan selamat kepada peraih hasil ujian nasional (UN) SMA tertinggi.,Priden,Presiden
"""Gulo getih kelopo putihe, balunge getih nyawiji dadi siji niatan suci, merdekake ibu pertiwi,"" tutur Deni Yuliantini di sepotong bait puisi.",merdekake,merdeka
"Abdalah ke Bogor didampingi Duta Besar Sudan untuk Indonesia Ibrahim Bushra Mohamed Ali, Antoni Jervase Yak (Direktur Kepemudaan), Khalid Bin Ali (Penasehat Menbudpora), Khider Ahmed Musa (Ketua Federasi Nasional Kepemudaan), Sami Anthony (Ketua Federasi Kepemudaan Cabang Khartoum), dan Mohammed El Fateeh Ahmed Brema (Direktur Bidang Kepemudaan National).",Fateeh,Fatih
Namun Trachtenberg menyatakan acara itu bukan penyebab depresesi Brandt dan bukan pula yang mendorongnya bunuh diri.,depresesi,depresi
"Bahkan, Hamilton adalah dididikan tim McLaren sejak remaja.",dididikan,didikan
"Pesawat pengangkut personel militer itu lepas landas dari Provinsi Tamanrasset di bagian Aljazair dan hendak menuju timur kota Constantine, seperti yang dilansir APS.",Tamanrasset,Tamanghasset
"""Jadi koleksi keris dari Majahit misalnya itu panjang.",Majahit,Majapahit
Chipset Snapdragon 820 64 bit diproduksi dengan proses 14nm yang dibekali CPU Kyro empat core dan GPU Adreno 530.,Kyro,Kryo
"""Agar masyarakat bisa mengelola keuangannya secara bijak, salah satu caranya dengan melakukan transaksi non tunai menggunakan aplikasi berbasis teknologi IT,"" kata Anggota Komisi XI Bidang Keuangan, Perencanaan Pembangunan, Perbankan DPR-RI Indah Kurnia saat melakukan sosiliasi Gerakan Nasional Non Tunai dalam acara Jalan Sehat bersama warga di wilayah Gunung Anyar Kota Surabaya, Minggu.",sosiliasi,sosialisasi
"Pelaksana Tugas Sekretaris Daerah Kota Semarang Harini Krisniati mengatakan, pengoperasian BRT ini dilakukan tanpa sosialisasi karena melanjutkan janji Pemkot Semarang untuk segera meluncurkan transportasi massal ini setelah semp at gagal pada Senin lalu akibat kendala administrasi tersebut.",semp,sempat
"Ia menunjukkan alamat terakhir Nila yang berekja di Petaling Jaya, Kuala Lumpur, Malaysia pada seseorang bernama Ambdullah Mahmud bin Abdullah Hasan.",berekja,bekerja
"Berbeda nasib dengan Ingosltadt dan Darmstadt yang memperoleh promosi mutlak ke Bundesliga, Karlsruher harus melakoni laga playoff dua pertemuan menghadapi peringkat 16 klasemen akhir Bundesliga Hamburger SV.",Ingosltadt,Ingolstadt
"""Anggapan publik setelah pengseran ini, PPP akan beralih mendukung partai koalisi pendukung Jokowi-JK.",pengseran,pelengseran
Stasiun yang akan dibawangun rusunawa yakni Stasiun Manggarai dan Tanah Abang.,dibawangun,dibangun
Bersama kedua tersangka tim gabungan membawa barang bukti berupa asatu chainsaw dan dua potong kayu minyak ukuran 10x25 centimeter dan panjang 4 meter.,asatu,atau
Di antaranya sungai Kemuning dan sungai Jombang yang menjadi pertemuan dua arus sungai di wayah selatan dan utara Pamekasan.,wayah,wilayah
"Jakarta (ANTARA News) - UU Nomor 18 Tahun 2002 tentang Sistem Nasional Penelitian, Pengembangan dan Penerapan Ilimu Pengetahuan dan Teknologi (Sisnas P3 Iptek) yang dikeluarkan sebagai usaha melakukan lompatan dan mengejar ketertinggalan dari bangsa lain dalam penguasaan iptek dipertanyakan efektivitasnya.",Ilimu,Limu
"Khusus mengenai operasi di Kunduz, kepolisian Afganistan (ANP) dalam pernyataannya mengungkapkan kebijakan itu diambil untuk membersihkan jalan utama penghubung Kota Kunduz ke Distrik Dasht-i Archi dari serangan militan dan perampok bersenjata.",Dasht-i,Dasthi
Aalagi kasus ini telah berlalalu hampir lima bulan.,berlalalu,berlalu
"Pak Brewok, pengemudi angkutan kota jurusa AMG (Arjosari- Mergosono-Gadang), mengeluhkan aturan peremajaan yang memberatkan pemilik dan gilirannya pengemudi.",jurusa,Jurusan
"Dia sudah bisa menata-nata sepatu, buka baju, sudah ahli semuanya.",menata-nata,menata-menata
"Khusus angkutan barang, tambah Edi, pada tahun 2016 akan terjadi lonjakan volume dalam jumlah signifikan sejalan dengan selesianya jalur ganda (double track) angkutan barang di wilayah Sumatera Selatan.",selesianya,selesainya
Para pedagang ini berasal dari Paguyuban Pedagang Pakaian Layak Pakai (P3LP).,Pakai,Pakaian
"Meski demikian, Sudarto bersyukur tidak ada korb an jiwa dalam musibah ini.",korb,korban
"""Andi Diansyah dan Iwan Chermawan malaham memanfaatkan kepercayaan yang diberikan terdakwa tersebut untuk menyetujui tiga kontrak film yang dimiliki terdakwa dengan me-mark-up nilai harga yang tidak wajar,"" tambah hakim Arifin.",malaham,malah
"Selain itu, penjualasan saham di operator penambang gas alam sebanyak 31 persen  DESFA.",penjualasan,penjualan
"Sementara hasil digitalilasasi nantinya akan kita simpan di Museum Nasional,"" kata Oman.",digitalilasasi,digitalisasi
Koesmadi mengaku Dinas Kehesatan telah melakukan pengawasan untuk kasus vaksin palsu ini.,Kehesatan,Kesehatan
Penembakan Charr terjadi hanya bebrepa pekan setelah ia dipukul KO oleh Mairis Breidis.,bebrepa,beberapa
Penelitian  pentuan tarif juga paling lama satu bulan.,pentuan,penentuan
"Mendapatkan pemainp-emain dnegan fisik yang prima,""kata Fung.",pemainp-emain,pemain-pemain
"Menurut mereka, serangan tersebut merupakan balasan dari pengerebakan yang dilakukan militer Kenya terhadap beberapa masjid di Mombasa.",pengerebakan,penggerebekan
"Dan juga berdasarkan informasi dari salah seorang tersangka penyerangan Polsek Pirime, Kabupatne Lanny Jaya beberapa waktu lalu,"" kata Kabid Humas Polda Papua Kombes Pol I Gde Sumerta Jaya di Jayapura, Minggu.",Kabupatne,Kabupaten
Hal itu terbukti dengan kemampuan ekonomi Indonesia di saat terjaidnya krisis global beberapa saat lalu.,terjaidnya,terjadinya
"Saat ini kami terus melakukan koordininasi demi kelancaran pertandingan,"" kata Cheppy menambahkan.",koordininasi,koordinasi
"visa,"" kata petugas kedatangan dan pemulang Kantor Urusan Haji Daerah Kerja Makkah, Iskandar M Noor, di Makkah, Kamis.",pemulang,peluang
"Dalihnya, bukti-bukti yang dimilili paling kuat.",dimilili,dimili
"Selanjutnya, saat bertemu dengan pasanganan di dunia maya, Razi menyarankan untuk tidak memberi nomor ponsel sebelum mengenal pasangan lebih jauh.",pasanganan,pasangan
"Jaksa harus memberikan alasan yang rasional kepada kami apa dasar dan motif para legilstor aktif tersebut belum juga dihadirkan,"" kata Zulfahmi yang juga wakil Ketua Pengadilan Negeri (PN) Makassar ini.",legilstor,legislator
"""Pdhl yg dismpikan Mendagri tak ada yg salahkan Jokohok.",dismpikan,disampaikan
"""Soalnya saya pernah pulnag kampung tapi gaji belum keluar.",pulnag,pulang
"""Di dalam kelas, bukan hanya ada mahasiswa dan dosen, ada nyamuk dan ular juga bisa masuk.. mana perhatiannya,"" kata perwakilan mahasiswa FKIP  ini.",masuk..,masuk
"Italia menyerap impor dari Indonesia senilai 2,1 miliar dollar AS, sedangkan eskpornya hanya 1,6 miliar dollar AS.",eskpornya,ekspornya
"Berdasarkan data GPS tersebut, ia mengatakan ambleas tanah tercepat antara 20 hingga 25 cm per tahun terjadi di sekitar Senayan, Gedung DPR di kawasan Jalan Gatot Subroto,  Joglo.",ambleas,asambleas
"Syamsul menegaskan melalui SHS ini, diharapkan akan memberikan dampak positif, di antaranya akan muncul persaingan yang sehat antar lembaga pelayanan eksehatan melalui koordinasi Pemkot Surabaya.",eksehatan,kesehatan
"Sekalipun begitu, ia mengatakan, seluruh wilayah Aceh masih membutuhkan banyak perhatian pembangunan untuk meningkatkan kesejahteraan masyarakat.-",masyarakat.-,masyarakat
"Namun, tidak menutup kemungkinan akan berkunjugn juga ke Musi Banyuasin karena tempatnya yang berdekatan,"" ujar Lidya.",berkunjugn,berkunjung
"Bayi perempuan malang itu diperkiraankan sudah dua hari dibuang ke sungai oleh orang tuannya, karena bayi tersebut sudah mulai membusuk.",diperkiraankan,diperkirakan
"Mangindaan menegaskan bahwa Pancasila harus dipelajari terus, digali, dipahami dan dipraktikan karena Pancasila tidak berjiwa statis, melainkan sangat dinamis.",dipraktikan,dipraktekkan
"Keluaganya telah diberihathukan oleh KBRI,"" kata Koordinator Fungsi Penerangan dan Sosial Budaya KBRI Kairo, Windratmo Suwarno kepada ANTARA di Kairo, Rabu.",diberihathukan,diberitahukan
Jokowi shalat sunnah di Raudoh Rasulullah Madinah,Raudoh,Raudhah
"Menteri Luar Negeri UAE Anwar Gargash awal pekan ini mengecam tuduhan-tuduhan bahwa UAE terlibat dalam serangan-serangan bom, pertama diberikakan surat kabar AS The New York Times dan pasukan Islam di Libya.",diberikakan,diberikan
Wassalam mualaikum warohmatulohi wabarokatuh.,warohmatulohi,warohmatullahi
Kedutaan besar negara yang warganya masuk daftar narapadina mati yang segera dieksekusi juga sudah mendapat surat pemberitahuan.,narapadina,narapidana
Tapi tanpa sponsoship juga tidak mungkin karena pemerintah belum bisa hadir sepenuhnya maka masuklah sponsorhsip di situ.,sponsorhsip,sponsorship
Balon-balon dilepaskan ke udara sebagai berwujudan pelepasan dosa.,berwujudan,berwujud
Hans Sachs lahir tahun 1881 dan berpfoesi sebagai dokter gigi.,berpfoesi,berprofesi
"Alumnusnya malah cuma satu tahun,"" ujar Diana Dewi, ibu Aca.",Alumnusnya,Alumninya
"MAKASSAR, SELASA -  Menyambut penawaran wilayah kerja pertambangan minyak dan gas baru kepada investor, sedang digagas sinergi antarpemerintah provinsi untuk mengelola potensi tambang  yang te rletak di 14 provinsi, termasuk di Sulawesi dan Indonesia Timur.",rletak,terletak
"""Terorisme itu musuh keamanan, musuh perdamaian, musuh kita semua, maka kita harus memberantas terorisme dan menyeselesaikannya secara komprehensif,"" katanya.",menyeselesaikannya,menyelesaikannya
"Anggaran transfer ke daerah dan Dana Desa tahun 2016 ditetapkan sebsar Rp770,2 triliun terdiri atas Dana Perimbagan Rp700,4 triliun, dana insentif daerah Rp5 triliun, dana Keistimewaan Yogyakarta Rp17,8 triliun dan Dana Desa Rp47 triliun.",Perimbagan,perimbangan
"Deputy Joint Special Representative (JSR), Jaseph Mutaboba mewakili UNAMID juga memuji peran pentingan Kontingen Garuda Indonesia dalam menciptakan suasana kondusif di kawasan itu.",pentingan,kepentingan
Gerakan menanam pohon juga diharapkan amenbangun kesadaran lingkungan di tengah warga untuk menagkal banjir bersama-sama semua pihak.,amenbangun,membangun
"Namun, langkah hukum dipastik an semakin me nunda kinerja DPRD untuk rakyat karena membutuhkan proses waktu panjang.",dipastik,dipastikan
"KUPANG, KOMPAS.com - Empat dari lima anggota Komisi Pemilihan Umum (KPU) Kabupaten Flores Timur, Nusa Tenggara Timur, diepcat karena terbukti melanggar kode etik.",diepcat,dipecat
