context,wrong,right
"""Selama ini, masyarakat menganggap jamur sebagai racun, karena itu kami bermaksud mengubah pandangan masyarakat yang salah itu melalui jamur tiram dalam baglog untuk ucapan selamat, seperti happy engagement, I love u, be happy, waiting for you, rindoe kamoe, maafkan salahkoe, dan sebagainya.",rindoe,rindu
"Sebagai akibat dari kegagalan ini, beberapa sel binatang memiliki genotipe betina dan yang lain jantan, membuat binatang itu memiliki karaktersitik jantan dan betina.",karaktersitik,karakteristik
"Silvarani, penulis yang telah menovelisasi film ""Super Didi"" dan ""3 Srikandi"", diberi kesempatan untuk mewujudkan cerita Cinta dan Rangga ke dalam lembaran kertas novel.",menovelisasi,novelisasi
"Selain bertanding, mereka akan menyapa penggemar mereka, memberi kepada pemain usia 8-14 tahun serta pelatihan terbuka 5.000 fans yang beruntung oleh staf pelatih Timnas Belanda, seperti Louis van Gaal, Danny Blind, Patrick Kluivert, dan Frnas Hoek.",Frnas,Frans
"Bagi pemantau lokal, jika melanggar aakn diproses secara hukum.",aakn,akan
"Ini tugas berat tapi menjadi komitmen G20, karena pertumbuhan bisa mengatasi masalah sosial, seperti pengangguran, kemsikinan dan ketimpangan,"" ujarnya.",kemsikinan,kemiskinan
"Namun, sistem transportasi ini dibutuhkan untuk memberi keuntungan jangka panjang dan membuat Indonesia tidak tertinggal dibandingak negara lain.",dibandingak,dibandingkan
"Menurut Dara Mentari, ketua bidang kompetisi yang juga puteri dari Achamd Dradjat pendiri Kodrat, saat ini olah raga Tarung Derajat sudah berkembang di hamopur semua negara ASEAN.",hamopur,hampir
"Ia mengatakan, melalui perjalanan panjang sejak 2000 oleh Tim  peneliti Balitbangdias bekerjasama dengan Politeknik Sorong dan  IRD,  mengembanga ikan pelangi dan pengembangan budidaya dilakukan secara maupun",mengembanga,mengembangkan
"Rekan satu tim Marquez, Dani Pedrosa, berada di ruutan ketiga.",ruutan,urutan
"Meski demikian, tanda-tadna tersebut tidak ada pada jerapah tersebut.",tanda-tadna,tanda-tanda
"Medan (ANTARA News) - Kepala  Dinas Pengelolaan Sumber Daya Air atau PSDA Sumatera Utara,  Dinsyah menegaskan, pembangunan Bendungan Lau Seimeme di Deli Serdang masih menunggu izin pakai lahan  dari Menteri Kehutanan.",Seimeme,Seisme
Ancamannya juga karena hilangnya habitat mereka dan defortasi yang disebabkan perluasan lahan pertanian dan perkebunan.,defortasi,deforestasi
"Batam (ANTARA News) - Gerak Jalan Napak Tilas Raja Ali Kenala yang dilaksanakan sebagai rangkaian pembukaan Hari Pers Nasional 2015 Kepri di Kota Batam, Minggu pagi diikuti oleh ribuan masyarakat Kota Batam.",Kenala,Kelana
Ia pun mengaku sangat mengagumi hasil kerjainan tangan dari masyarakat Indonesia.,kerjainan,kerajinan
"Italia tertinggal empat angka dari pemuncak klasemen Kroasia, yang di atas kertas memiliki 14 angka namun harus mendapat pengurangan satu angka menyusul hasil imbang 1-1 dengan Italia pada Juni setelah simbol stastika muncul di lapangan sebelum pertandingan di Zagreb.",stastika,statistika
"Akinffeyev yang kini berusia 26 tahun diharapkan memberi sesuatu yang berharga bagi negaranya, sementara mantan pemain belakang Chelsea, Yuri Zhirkov dihararapkan dapat membela timnas Rusia.",dihararapkan,diharapkan
"""Mudah-mudahan Prabowo-Hatta bisa mengentaskan bangsa Indonesia dari keawamanan dan menjadi bangsa yang maju sehingga tidak mudah percaya dengan fitnah dan pencitraan,"" ujarnya.",keawamanan,keamanan
Pallium adalah salah satu vestimentum gerejawi dalam Gereja Katolik Roma yang selama berabad-abad dianugerahkan oleh Paus kepada para uskup metropolit dan primat sebagai lambang dari yurisdiksi yang diembankan kepada mereka oleh Tahta Suci.,metropolit,metropolitan
"Untuk setiap tugas, anak-anak ini diberi waktu lima menit mengerjakan lalu istirarahat dengan waktu yang sama, kemudian diukur denyut nadi dan kondisi fisiknya.",istirarahat,istirahat
"Dalam aksi ini, pendemo melakukan aksi teatrikal berupa memotongan ayam.",memotongan,memotong
"Setelah malam, ketika pusat kota lama Lille dipenuhi penduduk setempat yang menyaksikan dari televisi kemenangan Prancis dari Albania, konfrontasi antas kelompok-kelompok kecil pendukung memaksa polisi anti huru-hara campur tangan, memisahkan para pendukung dengan menggunakan semprotan merica, anjing dan granat akustik.",antas,antara
"""Dengan penghargaan ini pemerintah berharap dapat bekerjasama dengan kelompok masyarakat pribumi untuk meningkatkan pelayanan kepada mereka dan mengakhiri kenjangan yang selama ini terjadi antara masyarakat pribumi dan non pribumi,"" terang dia.",kenjangan,kesenjangan
"Oleh karena itu, dirinya meminta semua pihak, khususnya TNI dan Polri untuk lebih kuat dalam menjaga keadulatan negara ini agar disegani oleh negara lain.",keadulatan,kedaulatan
"""Kami berharap peran aktif anda untuk mengakhiri serangan Arab Saudi etrhadap kami karena tak memiliki alasan,"" isi surat yang ditulisnya pada PBB.",etrhadap,terhadap
"Sebab, jika keduanya tanpa menawarkan konsep dan perubahan, berarti hanya merupakan suksesi biolgois atau sekadar power shift.",biolgois,biologis
Dia selalu berharap anaknya akan meneleponnya untuk melakukan kontak dan telah meng-email-i Jobs beberapa kali dalam upaya untuk berbicara.,meng-email-i,mengemaili
Perjanjian perdamaian yang difasilitasi oleh Polda Jabar dan Polda Metro Jaya tersebut ditandai dengan penandatangnaan fakta perdamaian  Ketua Viking Persib Fans Club dan Ketua Jakmania yang disaksikan oleh ratusan perwakilan kedua kubu suporter sepak bola itu.,penandatangnaan,penandatanganan
"""Belum ada komunikasi appaun selain berkomunikasi di internal KPK sendiri,"" ungkap Johan.",appaun,apapun
"Satuan Tugas Kontingen Garuda XX-J yang terdiri atas 151 anggota TNI Angkatan Darat, 19 TNI Angkatan Laut dan lima TNI Angkatan Udara juga bergabung dengan misi yang bersifat multidimesi di Kongo.",multidimesi,multi-dimensi
"London (ANTARA News) - Pelatih asal Belanda Ronald Koeman diangkat sebagai pelatih baru Everton pada Selasa setelah Southmapton menerima pengunduran dirinya, demikian dikatakan klub liga Inggris tersebut.",Southmapton,Southampton
Materi yang membentuk Tata Surya adalah awan debu dan gas yang mengelingi bintang mudanya.,mengelingi,mengelilingi
"Ia juga mengaku belum tahu arti kata ""brayut"" meskipun mencoba mengira-ira bahwa kata itu kemungkinan berasal dari ""brayat"" dalam bahasa Jawa yang berarti keluarga besar.",mengira-ira,mengira-ngira
"""Trans Kalimantan dapat memperlancar distribusi kebutuhan warga di wilayah Kaltim, sehingga gangguan pasokan dapat dikurangi,"" kata Capres yang mengusung visi Indonesia Adil, Makmur dan ber-Martabat (AAM).",ber-Martabat,bermartabat
"Kantor berita Reuters mealporkan, pihak berwenang di Burkina Faso menunjuk mantan menteri luar negeri Michel Kafando sebagai presiden transisi.",mealporkan,melaporkan
"Tajuk tersebut diterbitkan setelah sekelompok orang mengenakan rompi oranye bertuliskan ""Shariah Police"" melakukan patroli di jalanan-jalan kota Wuppertal.",jalanan-jalan,jalan-jalan
"""Dalam praktiknya forum mengenai penentuan saksi dilakukan bersama-sama dengan satgas, direktur dan kontrol dari deputi, ada mekanisme internal yang dibangun, teman-teman penyidik punya kebebasasan untuk menentukan siapa yang perlu dipanggil,"" jelas Bambang.",kebebasasan,kebebasan
"CO. ID,PALEMBANG--Sejumlah maskapai penerbangan menunda keberangkat pesawat tujuan Jakarta akibat tebalnya kabut asap di Bandara Sultan Mahmud Badaruddin II Palembang, Sumatera Selatan, Senin pagi.",keberangkat,keberangkatan
"""Ini memang yang kami harapkan selama ini, karena jika mengandalkan layanan PDAM yang tidak mencukupi kami sangat kesulitan memenuhi kebutuhna air bersih,"" katanya.",kebutuhna,kebutuhan
Kooridnator Komisi untuk Orang Hilang dan Korban Tindak Kekerasan (KontaS) Haris Azhar mempertanyakan siapa yang mewacanakan rekonsiliasi sebagai solusi.,Kooridnator,Koordinator
Nerazzurri gagal memanfaatkan permainan dominannya setelah kebobolan pada menit 55 ketika Molinaro memaksimalahkan  Maxi Lopez dengan menaklukkan kiper Samir Handanovic lewat tendangan kaki kanannya.,memaksimalahkan,memaksimalkan
"Iaenuturkan jika bus tidak memiliki , maka pengemudi akan memacu kendaraannya dengan tidak terkontrol dan hanya menggunakan saja dan itu cukup membahayakan keselamatan.",Iaenuturkan,Menuturkan
"Dikatakan Keymutu, proses penangkapan dan penahanan atas kliennya merupakan pelanggaran hukum dan hak asasi manusia.",Keymutu,Kelimutu
"""Beberapa peraturan tersebut diantaranya terkait dengan regulasi mengenai tenaga kerja, standarisasi dan peraturan mengenai sertififikasi halal,"" ujarnya.",sertififikasi,sertifikasi
Pertamina diyakini sudah mengetahui antrena panjang pembeli BBM.,antrena,antre
"Namun, rumor-rumor tak sedap itu kemudian dimentahkan dengan penampilanannya di depan publik dengan wajah yang lebih segar meskipun dalam beberapa bulan terakhir Chavez tampil dengan kepala plontos.",penampilanannya,penampilannya
"""Tidak dibenarkan siapa pun menghina, merendahkan ataupun mendeskriditkan kinerja aparat, apalagi sesama aparat, kita tindak tegas.",mendeskriditkan,mendiskreditkan
"Abdul mengatakan setelah puncak haji, pemerintah menegoisasi agar jamaah masuk .",menegoisasi,menegosiasi
"Selain itu,  kurangnya pasokan barang kebutuhan pokok terutama sayur, buah, dan daging segar asal dalam negeri abik dari segi jumlah ketersediaan dan harga.",abik,baik
"Menurutnya, keniakan yang berada diakhir bulan ini sangat terasa sekali, terlebih dirinya belum menerima gaji dari kantornya.",keniakan,kenaikan
"Selain itu, para pemain Arema juga diminta untuk lebih disiplin dan bersabar dalam neghadapi Persepam, sebab Persepam merupakan tim yang cukup tangguh, meski berstatus tim promosi.",neghadapi,menghadapi
Janji-jani tersebut ditagih mahasiswa ke kantor Bupati Pamekasan.,Janji-jani,janji-janji
"Manager Humas PT KAI Daop 8 Surabaya, Sumarsono mengatakan pengunaan tiket thermal untuk mengantisipasi adanya antrean pada saat melakukan pencetakaan tiket secara mandiri.",pencetakaan,percetakan
Kerusuhan saling melempar botol minuman dan benda keras antara pendukung kedua kebelasan timbul.,kebelasan,kesebelasan
Raya Casablanca arah Timur depan Kuburan.- Casablanca sebelum Fly Over Supomo.- Jl.,Kuburan.-,Kuburan
"Efeknya, harusnya korupsi hilang,"" ujar Fahri Fahri dalam diskusi Menimbang Eksistensi KPK di Jakarta, Kamis..",Kamis..,Kamis
"""Penghargaan ini diberikan atas inovasi dan kreavitas para peneliti,"" katanya.",kreavitas,kreativitas
Mudah-mudahanya tidak berkaitan dengan pilgub Jakarta.,Mudah-mudahanya,mudah-mudahannya
"Hamilton mencatat waktu 1 menit 37.106 detik dan memacu kenadraannya lebih cepat dari pada dua pebalap Mercedes asal Jerman, Nico Rosberg dan Michael Schumacher.",kenadraannya,kendaraannya
"Meski satu abad sudah berlalu, kumpulan nasihat yang termaktub dalam Gurindam Dua Belas masih dan akan selalu menemukan relevasinya di masyarakat.",relevasinya,relevansi-nya
"""Ya, konstituen banyak yang meminta Pak Jusuf Kalla karena beliau memrepresentasikan umat Islam.",memrepresentasikan,mempresentasikan
"""Saya minta pada para pengacara tersangka Margrite jangan hanya cari sensasi dalam kasus Engeline,"" ujarnya di depan Pengadilan Negeri Denpasar.",Margrite,Marguerite
"Teganag tersebut, kata Hibrar, sudah cukup dapat memberi efek kejut yang cukup.",Teganag,Tegangan
"Setelah sukses dengan ekspedisi ini, Cordozo berencana menjualnya secara komersial dengan hraga 50.000 poundsterling per unitnya.",hraga,harga
"Menanggapi hal itu, Ketua Komisi VII DPR, Kardaya Warnika menilai kebijak pemerintah dalam menetapkan harga bahan bakar minyak tidak transparan.",kebijak,kebijakan
Malam itu ia menuangkan anggur Camanere ke gelas beberapa mitra bisnisnya.,Camanere,Carmenere
"Menurut dia, Rudi juga kerap mendapat sindiran soal pembeiran THR dari anggota Komisi VII DPR yang membidangi pertambangan, energi dan lingkungan hidup saat rapat.",pembeiran,pemberian
"Jadi perlu kecermatan dalam mengumpulkan dan menentukan fakta-fakta hukum yang ada, termasuk keterangan-kerangan saksi.",keterangan-kerangan,keterangan-keterangan
"Tapi, juga salah satu agen pemain dan pelatih kenamanaan Indonesia.",kenamanaan,keamanan
"Mengutip data ukuran kemiskinan Bank Dunia yang mengatakan penduduk miskin adalah mereka yang pengeluarannya kurang dari dua Dollar AS per hari, Fuad mengatakan, tahun 2004 saat Susilo Bambang Yudhoyono mulai berkuasa jumlah penduduk miskinan mencapai 98,4 juta.",miskinan,kemiskinan
"Kubu Tito Vilanova yang sebentar lagi menjadi juara La Liga dan mungkin Liga Champions, telah mengumumkan rencana bermain melawan China (3 Agustus) dan Thailand (7 Agustus) selama tur prammusim-nya di Asia.",prammusim-nya,pramusimnya
Tampak diantaranya Adian Napitutupulu dan Endre Syaiful.,Napitutupulu,Napitupulu
Sebaliknya Prijono melihat pemerintah jusrtu kurang proaktif.,jusrtu,justru
Wamenhub mengemukakakan bahwa hal itu akan menjadi proyek percontohan mengingat perubahan tata kelola dari UPT menjadi kemitraan publik-swasta merupakan hal yang baru.,mengemukakakan,mengemukakan
"""Kita juga pasnag rambu tambahan di jalur alternatif,"" tegas Triyono.",pasnag,pasang
"""Ini adalah nama-nama PTS di Meulaaboh yang telah mendapat legalitas operasional dari Direktorari Perguruan Tinggi Swasta Sumatra Utara-Aceh tahun 2011, yang diterbitkan oleh Kementrian Pendidikan Nasional,"" katanya.",Direktorari,Direktori
"Istri bupati ikut populerkan ""Mie Belitung""",populerkan,dipopulerkan
"Berikut garis besar pengurus DPP Partai Golkar 2009-2015:- Ketua Umum: Aburizal Bakrie- Wakil Ketua Umum: Agung Laksono, Theo L Sambuaga- Ketua Bidang Kaderisasi: Hafiz Zawawi- Ketua Bidang Organisasi: Mahyudin- Ketua Bidang Hubungan Eksekutif dan Yudikatif: Rusli Zainal- Ketua Bidang Hubungan Legislatif: Priyo Budi Santoso- Ketua Bidang Informasi: Fuad Mansyur- Ketua Bidang Perempuan: Ratu Atut Chosiyah- Ketua Bidang Pemuda: Yorris Raweyai- Bendahara Umum: Setyo Novanto- Sekjen: Idrus Marham- Wasekjen, di antaranya Muhidin, Ahmad Doly Kurnia, Titiek Soeharto, Mujib Rahmad, Nurul Arifin, dan Harry Azhar Azis.- Dan sejumlah ketua bidang lainnya beserta wakil-wakilnya.",Azis.-,Azis
"""Kongres nasional juga akan diisi dengan  seminar yang bertema Membangun Kebersamaan Dalam Kerangka Pluralisme Menuju  Harmonisasi Kehidupan Berbangas dan Bernegara,"" kata Leonard.",Berbangas,Berbangsa
Martinus mengatakan petugas kepolisian berupaya menjaga kondisi keamanan pengunjung dan kelancar aksi konser grup musik asal Inggris itu.,kelancar,kelancaran
"Para mentor berbagi berbagai macam ilmu, termasuk seperti bagaimana pertama kali mengetahui customer dan bagaimana memvalidisasi keinginan customer.",memvalidisasi,memvalidasi
"""Jika situasi meningkat, kami mungkin harus berpemikir mengenai tentara Uni Eropa.",berpemikir,berpemikiran
Hanya saja pihaknya optisimistis permasalahan teknis ini bisa diselesaikan secepatnya.,optisimistis,optimistis
"Daya tarik tersendiir bagi penonton,  ujarnya.",tersendiir,tersendiri
"Khususnya di Kalimanat Timur, lanjut Marwan, kawasan transmigras telah berhasil menjadi sentra ekonomi masayarakat setempat melalui Badan Usaha Milik Desa (BUMDes) Desa Padang Jaya Kecamatan Kuaro Kabupaten Paser yang telah memiliki aset senilai Rp1,3 miliar.",Kalimanat,Kalimantan
"Ada Presiden Zimbabwe Robert Mugabe, Xi Jinping, Sultan hassal Bolkiah, ada Presiden Jokowi.",hassal,hassanal
"Kami sudah memperingatakn warga melalui pengajian dan pertemuan lain, tapi kurang berhasil,"" jelas Suparyono.",memperingatakn,memperingatkan
"Olic, yang melakukan debut internasionalnya pada 2002, merupakan pemain peringkat keempat terbanyak memperkuat Kroasia, di bawah kapten Darijo Srna, kiper Stpe Plestikosa, dan bek yang telah pensiun Josip Simunic.",Stpe,Step
"""Mayoritas korban keracunan merupakan warga kurang mampu dan perlu mendapatkan perhatian, selain itu keluarga pasien hidrocepalus yang merupapakan warga Desa Pabuaran, Kecamatan Sagaranten, Kabupaten Sukabumi ini juga warga yang kurang mampu sehingga biaya pengobatannya ditanggung oleh pemerintah setempat,"" tambahnya.",merupapakan,merupakan
"Dia terluka akibat peganiayaan yang diduga dilakukan oleh anggota polisi berinisial YS, yang bertugas di Pospol Bijaepasu.",peganiayaan,Penganiayaan
"Namun, memang masih sulit menemb bek kokoh Serdadu Tridatu.",menemb,menembus
SBY menyerahkan penonkatifan pejabat negara berdasar ketentuan hukum yang berlaku.,penonkatifan,penonaktifan
Menurut dia pengirimiman tenaga guru ke AS ini merupakan tindak lanjut kerja sama antara Pemprov Sulbar dengan pemerintah Amerika Serikat untuk peningkatan kualifikasi tenaga pendidik di provinsi terbungsu ini.,pengirimiman,pengiriman
"Menteri Luar Negeri, Titus Corlatean, mengatakan pada pertemuan yang sama Romania khawatir oleh perkembanagn yang memburuk di Suriah, dan penting bagi misi PBB di lokasi untuk bisa menyelesaikan secepatnya penyelidikannya mengenai dugaan penggunaan senjata kimia.",perkembanagn,perkembangan
"Makassar (ANTARA News) - Ketua Panitia turnamen sepakbola Sulsel Super League (SSL) U-21 Sri Syahril yang menjadi korban pengeroyokan oknum suporter Pereska Bosowa, memutuskan melapor ke Polsekta Ujung Pandang Makassar, Senin.",Pereska,Perseka
"Tidak hanya itu, Bonek juga tengah menyiapkan aksi di arena Konggres PSSI yang dijadwalkan bakal digelar di Makaasr pada 17 Oktober mendatang.",Makaasr,Makassar
"Silvya melanjutkan, PT Jakpro nantinya harus mempersiapakan segala sesuatu yang berkaian dengan perbaikan tersebut.",berkaian,berpakaian
"Tim yang sebelumnya bernama Campos Meta 1 itu baru memiliki mantan juara seri GP2 Bruno Senna (Brasil), dan diperkirakan Karun Chandhok akan menjadi tandemnya.- Daftar tim F1 2010:1.",tandemnya.-,tandemnya
"Malah disejumlah negara Eropa, banyak ibu-iu yang akan melahirkan sengaja mintan bantuan kepada lumba-lumba.",mintan,Minta
"""Saya turut perihatinkan dengan perilaku sebagian masyarakat saat ini karena kurang memahami nilai-nilai Pancasila, Bhineka Tunggal Ika, UUD 1945 dan NKRI,"" katanya.",perihatinkan,perhatikan
Penurunan tersbeut berselang 19 hari dari kebijan pemerintah menurunkan harga BBM pada 1 Januari 2015.,kebijan,kebijakan
"Pertempuran terpisah pada Jumat menewaskan dua terduga militan di Kanchipora dekat lokasi wisata Gulmarg, kata polisi.",Kanchipora,Kanchipuram
"Itu pasti tidak benar, makanya siswa jangan percaya,"" kata Karno, usai memantua pelaksanaan UN hari pertama di SMAN dan SMKN 1 Pandeglang, di Pandeglang, Senin.",memantua,memantau
Pengusaha jasa kontstruksi juga mengharpakan kebijakan kemudahan pengadaan material konstruksi dan pengurangan pajak impor.,mengharpakan,mengharapkan
"Hal tersebut, ia sampaikan dalam laporannya pada arpat pemutakhiran data Tindak Lanjut Hasil Pengawasan (TLHP) Penyelenggaraan Pemerintahan Daerah tahun 2015.",arpat,rapat
"Hatta Rasaja dan Idrus Marham  mewakiliki KMP, sedangkan Pramono Anung dan Olly Dondokambay mewakili  KIH.",mewakiliki,mewakili
Kemendikbud mengukur indeks integritas peksanaan UN salah satunya melalui analisis pola respon jawaban.,peksanaan,pelaksanaan
"Kejadian bermula saat korban yang hendak berkunjung ke kediaman kawannya, melintas di Jalan Bengkoolen Street, Kota Bengkulu, pada sekitar pukul 22.00 WIB.",Bengkoolen,Bengkulen
Tim crisis center Kemenpar masih menghitung sejauh mana pengaruhnya terhadap pariwisa dan berharap insiden tersebut tuntas dan aman agar industri pariwisata tidak terlalu lama tertekan oleh suasana seperti ini.,pariwisa,pariwisata
"Selain ini bouncing house, PRJ juga menyeidkan wahana kereta mini Thomas dan komedi putar mini.",menyeidkan,menyedihkan
Presiden Nigeria Goodluck Jonathan dikecam keras karena kegagalannya melumpuhkan Boko Haram yang keberhasialnnya merebut sejumlah daerah menimbulkan kekhawatiran hilangnya kekuasaan pemerintah  atas wilayah timur laut itu.(Uu.,keberhasialnnya,keberhasilannya
"Konsep edukasi yang akan melibatkan seluruh komponen jasa syariah meliputi, perbankan, lembaga keuangan non-bank, pelaku pasar modal, industri keratif dan pelaku usaha kecil  tersebut menjadi puncak kegiatan kampanye keuangan Islami bertema ""Aku Cinta Keuangan Syariah"" (ACKS).",keratif,kreatif
Demikiano The Global Times mengutip Luo Changping.,Demikiano,demikian
Adies Kadir kunjungi konstitues di Dapil Jatim I,konstitues,constitutes
"Kebetulan waktu itu pemerintahan Hindia-Belanda dipimpin Gubernur Jenderal Van Limburg Stirum, yang oleh DM Koch disebut Een internationaal georienteerd staatsman (seorang negarawan yang berorientasi internasional).",internationaal,internasional
"""Belum seluruhnya yang memberikan, kita minta keluagra berikan data korban ke posko antemortem di posko lokasi longsor Napal Putih atau di RS Bhayangkara Kota Bengkulu,"" kata dia.",keluagra,keluarga
"Dua meninggal, 54 terluka.- Agustus 2000: Pesawat Gulf Air jatuh di lepas pantai Bahrain.",terluka.-,terluka
"Sebagai tahap awal dalam program 100 hari kerja Mendiknas baru, diadakan pelatihan kepada sekitar 30.000 kepala sekolah dan pengawas guna memperkuat implemnetasi manajemen berbasis sekolah.",implemnetasi,implementasi
"Jadi tidak hanya KIH, tetapi KMP juga, semuanya lah, dan juga tentunya dengan lembaga-lemba tinggi lainnya.""",lembaga-lemba,lembaga-lembaga
"""Kami inginya serentak, sebab kalau nyicil nanamnya maka hamanya malah akan subur,"" katanya.",nanamnya,menanamnya
"Pria yang akrab disapa Ujang itu mengaku, manamejen Bintang Jaya telah menyelesaikan pembayaran gaji para pemain sebelum diliburkan.",manamejen,manajemen
"Kasus pemerkosana yang menonjol yaitu kasus yang menimpa R (35), warga Depok, yang diperkosa di dalam mikrolet M26 jurusan Kampung Melayu-Bekasi pada tanggal 14 Desember lalu.",pemerkosana,pemerkosaan
"Ini juga memainkan jejeraing petualang dan kelompok-kelompok kejahatan lain,"" kata dia.",jejeraing,jejaring
"Pertemuan itu dilakukan di Ruang Konferensi 6 North Lawn Buiding, Markas Besar PBB, New York, Rabu sore waktu setempat atau Kamis dini hari WIB.",Buiding,building
Para pengugnsi hanya pasrah melihat Satpol PP mengemasi tenda tempat berteduh mereka selama tiga pekan terakhir.,pengugnsi,pengungsi
"Yaitu, album Horror Vision pada 2009 dan Profanatik yang dipasarkan pada 2014 lalu.",Profanatik,Profanatica
"Kepala Badan Kesatuan Bangsa dan Perlindungan Masyarakat Kabupaten Bojonegoro, Lukman Wafi, menyebutkan hingga saat ini banjir luapan Bengawan Solo menerjang Kecamatan Margomulyo, Ngraho, Padangan, Kasiman, Malo, Kalitidu, Dander, Trucuk, Bojonegero, Papas, Balen, Sumberejo, Kanor, dan Baureno.",banj,banjir
"""Dengan tambahan ini, menurut rekapitalusi tim bakal calon, ada 85.239 berkas dukungan,"" ujarnya.",rekapitalusi,rekapitulasi
"Kendati demikian, dirinya meminta dengan berbagai program bantuan yang diberikan, tidak semerta-merta menjadikan masyarakat kampung nelayan menjadi malas.",semerta-merta,serta-merta
"Dia mengatakan, kendati desk Pemilu Presiden Kota Mataram telah mengumumkan hasil rekapilutasi hasil pemungutan suara Pilpres 9 Juli 2014, namun hasilnya belum bisa dikatakan hasil final.",rekapilutasi,rekapitulasi
"Jakarta (ANTARA News) - Pengunung Java Jazz 2015 di Jakarta International Expo Kemayoran, tetap antusias kendati hujan ringan mengguyur sejak pukul 15.00 WIB hari ini ketika loket dibuka.",Pengunung,pengunjung
"Mengenai keberadaan RMS, Suryadi mengatakan bahwa para aktivitis dari Maluku yang menginginkan kemerdekaan Maluku Selatan, sampai saat ini memang masih ada dan terus berjuang.",aktivitis,aktivis
"Pertengkaran terjadi saat larut malam, dan dalam keributan yang selanjutnya terjadi, putra serta suadara perempuan tersangka bergegas memasuki rumah tersebut karena mengira pasangan itu diserang.",suadara,saudara
Kejadinan ini berlangsung beberapa pekan yang lalu di sekitar kawasan Polres Kolaka.,Kejadinan,kejadian
"Berbekal informasi itu, tim Prabowo-Hatta langsung menuju lokasi penjualan paket banah pokok di Jalan Banyumas, dekat Masjid Sunda Kelapa.",banah,bahan
"""Ernawati, sudah digajnar penjara karena kasus korupsi lainnya, dan masih ada lagi kasus perkara lain sedang ditangani,"" ujarnya.",digajnar,diganjar
"Anang mencontohkan, sekolah bisa menerapkan pengawan berupa kajian yang bersifat rutin dan berkelanjutan.",pengawan,pengawasan
"Langkah untuk mencekal mereka bisa memperburuk ketegangan antara misi Perserikatan Bangsa Bangsa dan Presiden Joseph Kabila, yang telah menyerukan penarikan pasukan Perserikan Bangsa Bangsa dalam jumlah besar.",Perserikan,Perserikatan
"Untuk itu, ia berharap, Pemerintah Ausatralia dapat segera memberikan klarifiskasi dan menyelesiaakan masalah ini.",menyelesiaakan,menyelesaikan
Pesawat AirAsia QZ8501  yang membawa 155 penumpang dan tujuh awal hilang kontak di Selat Karimata sepekan lalu dan diyakini dijatuh di laut.,dijatuh,jatuh
"Menurut Todung, atas dasar tersebut, pihaknya kini kembali mengajukan gugagatan ke Pengadilan Tata Usaha Negara (PTUN) dalam tingkat yang lebih tinggi.",gugagatan,gugatan
Sarjana Mulsim Syiah dari Inggris itu pernah berkhotbah tentang tema homoseksualitas di Orlando pada Maret 2016.,Mulsim,Muslim
"Itu kami berpikrian ranahnya etika kalau itu dikualifikasikan sebagai suatu kesalahan,"" katanya.",berpikrian,berpikiran
Maqdir juga enggan berkomentar megnenai kemungkinan penahanan Lino.,megnenai,mengenai
"Dia menambahkan akan berfokus pada hal-hal mendasar, seperti ketersediaan listrik, percepatan perizinan, pengolaan ESDM dan Migas dengan baik serta mengurangi ekspor bahan mentah tanpa diproses.",pengolaan,pengelolaan
"Diantarnya Ketua DPR sekaligus Wakil Ketua Majelis Tinggi Partai Demokrat Marzuki Alie, Menteri Perdagangan Gita Wirjawan dan Ketua DPD  Irman Gusman.",Diantarnya,diantaranya
Nomor unik tersebut antara lain untuk menghindari terjadinya pemalsuan ijasah.,ijas,ijasah
"Jika menang, lawan paling mungkin didadapi di babak kedua adalah unggulan keempat asal Taiwan, Chou Tien Chen.",didadapi,didandani
