context,wrong,right
Saat ini pelaku ditahan di Markas Polsek Tambora dan dikenanai Pasal 365 dengan tuntutan maksimal 7 tahun penjara.,dikenanai,dikenai
"""Kami kalah kualitas dan kalah segalan dari tim lawan.",segalan,segalanya
"Ia menjelaskan dari keterangan saksi diketahui bahwa kebakaran utama brasal dari gedung  Holder Panel dan sumber api dari batu bara yang sementara berada  kramser konveor (mesin pengantar batu bara) nomor  C4, C5, C6.",konveor,conveyor
"Burki; Sokratis, Bender, Hummels (Ginter); Piszczek, Castro (Kagawa), Weigl, Schmezler (Eric Durm); Mkhitaryan, Aubameyang, Reus.",Schmezler,Schmelzer
"""Jadi, sepertinya sudah bisa dipastikan yang bersangkutan, Nazaruddin, untuk dimintai keterangan dalam kaitan penyelidikan KPK dalam revitalisi sarana dan prasarana Diknas 2007, tidak datang hari ini,"" kata Johan di Gedung KPK, Jakarta, sore ini.",revitalisi,revitalisasi
"Di tambah lagi, sinyal handpon kru pesawat Aviastar terdeteksi di Kabupaten Luwu,"" katanya.",handpon,handphone
"""Jadi harga dagang sapi ini, sejak bebepa bulan lalu sebenarnya relatif stabil.",bebepa,beberapa
"Petani penggarap hutan di sekitar aliran sungai diberi kelinci, domba atau dilatih untuk bercocok tanam di hutan dekat aliran sungai, sedangkan sisanya akan diberikan hal yang sama setelah rencanaannya dirumuskan dan dilaksanakan februari 2016.",rencanaannya,rencananya
"""Kami telah melakukan koordinasi bersama tim Mabes Polri dan Kemerinterian Kehutanan tersebut.",Kemerinterian,Kementerian
Para pejabat Jordania mengemukakan kepada Reuters bahwa mereka merasa dihina oleh peringatan Suleiman yang disiarkan jarinagn media sosial  bahwa rudal Alexander yang mutakhir buatan Soviet dapat menghantam kerajaan itu apabila militer AS menggelar setidaknya dua baterai rudal Patriot akhir bulan ini.,jarinagn,jaringan
Enam tewas dalam serangan mortir teroris di Sweida,Sweida,Swedia
"Selanjutnya, anggota Komisi C DPRK Aceh Tengah, Yurmiza Putra menjejelaskan salah satu kontrak yang dimaksud adalah dokumen kontrak antara PLN dengan Hyundai.",menjejelaskan,menjelaskan
"Action Conter La Faim (ACF), organisasi kemanusiaan internasional, melalui kemitraan dengan organisasi non-pemerintah setempat --Ground Water Exploration Inc. (GWEI), saat sedang menilai sumber air beberapa sekolah di Bomi, Gunung Grand Cape dan Desa Montserrado.",Conter,Contre
Dua pemuda itu terancam hukuman seumur hidup karena membunuh secara berebcana sesuai Pasal 340 Kitab Undang-undang Hukum Pidana (KUHP) dan pencurian disertai tindak kekerasan hingga mengakibatkan kematian seseorang seperti diatur Pasal 365 KUHP.,berebcana,berbencana
"Dia mengatakan, pada Kamis pagi, Wali Kota Manado, GVL Lumnetut telah datang ke lokasi tersebut untuk melihat para warga korban banjir.",Lumnetut,Lumentut
"Menurut dia, warga luar Jakarta knii bisa datang ke Jakarta untuk mencari pekerjaan atau mengadu nasib di ibukota.",knii,kini
"Sedangkan pejabat yang mereka suap, Akil Mochtar dihukum seumur hidup karena menerima uang lebih dari 10 penangananan sengketa pilkada.",penangananan,penanganan
"Posisinya diikuti oleh pemain Serbia, Novak Djokovic.- Peringkat ATP1.",Djokovic.-,Djokovic
"""Meskipun hari buruh sepi, tetapi pengamanan tetap dijaga ketat untuk mencegah hal-hal yang tidak diinginkan,"" kata Komandan Kompi Sabhara Polda Banten Iptu Hero di Pintu Tol Kragilan Sernag saat dihubungi di Lebak, Jumat.",Sernag,Serang
"Dalam daftar resmi susunan pemain, Firman yang pada pertandingan melawan Vietnam Sabtu lalu menjadi cadangan dan baru masuk pada pertengangan babak kedua menggantikan Manahati Lestusen, kini menjadi kapten tim Indonesia untuk pertandingan melawan Filipina.",pertengangan,pertengahan
"Sedangkan, dari Gerakan Indonesia memilih hadir antara lain, Rektor Universitas Islam Negeri Syarief Hidayatullah Jakarta Komaruddin Hidayat, aktivis Indonesia Corruption Watch Teten Masduki, sutradara film Garin Nugroho, Direktur Eksekutif Lembaga Survei Indonesia Buhanuddin Muhtadi, dan penelitisi senior CSIS J Kristiadi.",penelitisi,peneliti
"Anehnya, lanjut Muji, meskipun terdapat pergantain pasal namun, nomor laporan tetap menggunakan pasal 351 ayat 3.",pergantain,pergantian
"Manaher Persires Banranegara Burgo Pane, mengatakan, timnya pada babak pertama mampu mengimbangi permainan Persis, sehingga tidak ada gol.",Banranegara,Banjarnegara
"""Saya tidak mungkin menunurunkan pemain yang baru sembuh cedera, dimainkan dengan beban harus menang.",menunurunkan,menurunkan
"Sedangkan bagi kepentingan Indonesia, menurut dia, Predisen harus hadir dengan ""dignity"", menjelaskan kejadian kebakaran hutan dan lahan (karhutla) sekaligus langkah yang akan diambil untuk memperbaikinya di masa depan.",Predisen,Presiden
"Ia juga menyatakan, jika ada pihak-pihak yang merasa dirugikan atas kejadian tersebut syah-syah saja jika membuat laporan kepolisian.",syah-syah,sah-sah
Operasi darat ini dilakukan setelah militer Pakistan melakukan serangan udara dan artileri ke sejumlah sasaran militan di wilayah yang terletak dekat perbataasn Afganistan.,perbataasn,perbatasan
"Dari pengakuan mereka, Gafatar tidak mewajibakn shalat.",mewajibakn,mewajibkan
"""Potensi konfilk itu harus dicegah dengan perbincangan rasional ilmiah antara negara-negara yang terkait, seperti antara Indonesia dengan Filipina dan Indonesia dengan Papua Nugini,"" katanya.",konfilk,konflik
"Menurut Yokka, tempat wisata yang menampilkan koleksi berbagai alat transportasi ini mendadak dikunjungi banyak pengunjung pada hari Imlek sampai sekitar 1.000 pewisata dari Kediri, Bandung, Depok dan Banjarmasin.",pewisata,wisata
Beliai itu sedang penciyraan.,Beliai,Belalai
"Telur-telur raksasa ini sebagian dihias dengan karakter-karatker yang paling disukai anak-anak di Inggris, seperti Moshi Monsters, Peppa Pig dan SpongeBob SquarePants.",karakter-karatker,karakter-karakter
Kerumuman warga berdesakan di satu atopek untuk mendapatkan obat.,atopek,apotek
"Aldy mempersembahkan emas bagi Indonesia setelah berhasil memukau juri lewat penampilan habis-habisannya pada final di Tennis Indoor, Gelora Bung Karno, Senayan, Jakarta.",habis-habisannya,habis-habisnya
"Kapal itu rencananya tiba sekitar pukul 16.00 WIT di dermaga Pelabuhan Yos Sudarso,"" kata Kepala Bidang Rehabilitasi Sosial Dinsos Maluku Yahya Balianan kepada wartawan, Jumat sore.",Balianan,Balian
Jakarta (ANTARA News) - KPK mengakui adanya pertemuan antara Gubernur Sumatera Utara Gatot Pujo Nugroho dengan petinggi partai Nasdem sehinga melakukukan pengusutan terhadap materi pembicaraan tersebut.,melakukukan,melakukan
"Karena ada konsekuensi besar pascamistar pengkuran (lewat high stakes testing), serta-merta subyek-subyek yang terlibat dalam ujian nasional menjadikan angka-angka yang ditetapkan oleh pemerintah sebagai tujuan.",pengkuran,Pengukuran
"Sebagai koordinator pengawas, UNJ bekerjasama dengan beberapa universitas lain seperti, Universitas Pancasila, Universitas Indonesia, Universitas Jayabaya untuk mengolah data tentang pengawas yang diberasal dari tiap Rayon.",diberasal,berasal
"Buku yang antara lain berisi kebijakan pertahanan Pemerintah Australia itu diserahakn dalam pertemuan bilateral antara Menteri Pertahanan Australia Marise Ann Payne dan Menhan RI Ryamizard Ryacudu di Kantor Kemhan, Jakarta, Senin.",diserahakn,diserahkan
"""Selama 40 hari setelah kebangkitan-Nya pada hari Minggu, tiga hari sesudah kematian-Nya di atas kayu salib, Yesus menunjukkan diri-Nya kepada para murid, dan dengan banyak tanda Ia membuktikan, bahwa Ia hidup.",kematian-Nya,kematianya
Single ini juga dipersembahkan sebagai jembatan menuju album baru Sandhy Sondro yang diberi nama Love Songs.,Sondro,Sandoro
"Pelalayanan yang diebrikan meliputi konsultasi sekolah, visa pelajar, penjemputan di Bandara Narita, pengantaran ke tempat tinggal di Tokyo, pengantaran ke sekolah, pengawasan belajar hingga kembali pulang ke Indonesia.",Pelalayanan,Pelayanan
"Karenanya, Luhut menekankan jika penanganan narkoba akan sama dengan penanagan terorisme.",penanagan,penanganan
"""Sesuai rencana diberangkatankan sore dari Malang dan akan dimakamkan besok pukul 10.00 WIB,"" kata Komandan Pangkalan Udara Utama TNI AU Adisujipto, Marsekal Pertama Imran Baidrus, di rumah duka yang juga kediaman mertua almarhum di Kampung Sidikan, Kelurahan Pandeyan, Kecamatan Umbulharjo, Kota Yogyakarta, Rabu.",diberangkatankan,diberangkatkan
"Pemanggilannnya terkait proses pembelian sebagian lahan Rumah Sakit (RS) Sumber Waras di Jakarta Barat pada 2014, yang menurut BPK terindikasi menyebabkan kerugian negara mencapai Rp 191 miliar.",Pemanggilannnya,pemanggilannya
"SURABAYA, KOMPAS.com - Musyawarah Perencanaan Pembangunan (Musrenbang) Kota Surabaya, Jawa Timur menetapkan 1.506 proyek nonfisik lolos untuk dikerajkan tahun 2013.",dikerajkan,dikerjakan
Keputusan untuk mengizinkan perempuan berpartisipasi dalam pemilan diambil oleh mendiang Raja Abdullah dan kebijakan itu dianggap sebagai warisan penting dari masa pemerintahannya.,pemilan,pemilihan
"Harus dicatat, setiap persamaan tidak diulang lagi.- Tahap ketiga, Pemecahan MasalahSiapkan kartu dot berjumlah 4, 7, 11, dan 16.",lagi.-,lagi
"Kepala Fungsi Penerangan dan Sosial Budaya KBRI Riyadh, Ahrul Tasni Fathurrahman kepada ANTARA Kairo, Kamis, mengisahkan, awalnya dugaan mutilasi itu dilaporkan Sudiyati -- ibu kandung Darmawati yang juga TKW di Arab Saudi -- kepada KBRI Riyadh.",Tasni,Tsani
"Satu pernyataan kepresidenan mengatakan, insiden itu terjadidi satu pantai di kawasan ibu kota, Conakry Ratoma.",terjadidi,terjadi
Peyandang disabilitas berkesempatan bekerja di BUMN,Peyandang,penyandang
"Pada pelaksanaan Istura kali ini, lanjut Endang, masyarakat dipersilahkan mengengilingi halaman depan dan belakang Istana Bogor.",mengengilingi,mengelilingi
Kompas mendapati lima SPBU dan hanya ada satu SPBU di daerah Tenggineneng yang menyediakan Pertamax.,Tenggineneng,Tegineneng
"Sosialisai tentang layanan ditingkatkan juga ditingkatkan agar pemerintah, layanan kesehatan dan masyarakat dapat sinkron,"" katanya.",Sosialisai,sosialisasi
Dr Sudirman Saad menyampaikan beberapa strategi pengelolaan potensi maritim Indonesia secara konprehhensif dan kebijakan Kementerian Kelautan dan Perikanan terkait dengan pencapaian kesejahteraan rakyat dari sektor maritim.,konprehhensif,komprehensif
"Rekannya Chris Paul mencetak 19 poin dan tujuh assist, center DeAndre Jordan menambah 17 poin, 20 reobund dan empat blok bagi Clippers yang menang beruntun untuk yang keempat kalinya.",reobund,rebound
"Seharusnmya masalah-masalah seperti kriminalisasi tidak perlu dibesar-besarkan kalau tidak ada ,"" ucap dia.",Seharusnmya,seharusnya
"Dalam ukuran zaman itu, Adinegoro berkinerja reporter sekaligus fotografer, infografer dan kartografer atau .",infografer,infographer
"Sejumplah partai yang sudah bergabung dalam koalisi besar ini terdiri dari Golkar, PDI-P, PPP, Gerindra, Hanura, PKNU, PDS, Partai Buruh, PPRN, PPNUI, dan PBR.",Sejumplah,sejumlah
"""Itu khas dan bisa di eksplore jasa akan didapat dari wisata.",eksplore,explore
Serangan roket hantam pelabuhan Israel selalatan Eilat,selalatan,selatan
Tujuannya hanya untuk memastikan pembayar sudah memiliki tempat untuk memakamkan keluarnyanya apabila nantinya meninggal dunia.,keluarnyanya,keluarganya
Berikut ini beberapa fakta menarik seputar GP Bahrain.- Sirkuit Internasional Bahrain yang terletak di kota Sakhir selalu jadi venue berlangsungnya GP Bahrain sejak pertama bergabung dengan Formula 1 pada 2004.,Bahrain.-,Bahrain
"Menteri Demitu juga menyimak pemaparan Dirut ASDP terkait pengawasan di sejumlah titik areal pelabuhan yang berbasis teknologi informasi, yang memberikan gambaran kompherensif tentang lalu lintas kapal penyeberangan di seluruh wilayah Indonesia.",kompherensif,komprehensif
"""Mereka akan menyebabkan kekacauan serius dalam tatatanan dunia,"" katanya.",tatatanan,tatanan
"""Mohon maaf, saya diinstruksikan tidak menerima tamu hari ini,"" kata Petugas Keamnaan Bandung Pilot Academy, Rizky di gerbang kampus berwarna biru langit di Jalan Padjadjaran Kota Bandung itu.",Keamnaan,Keamanan
"Bekas- bekas kebakaran masih terlihat di tiang-tiang beton di lantai 3, dibiarkan begitu saja tanpa ada perbaikan.",Bekas-,bekas
Sikap keras Indonesia yang memanggil pulang Dubes RI untuk Australia dan menghentikan kerja sama militer dan intelijen kedua negara serta ketakinginan Indonesia dalam membantu Australia dalam hal penanganan masalah irregular migrants adalah bagian dari strategi diplomasi Indonesia yang sangat terukur agar Australia meminta maaf kepada Indonesia.,ketakinginan,ketidakinginan
"""Baca secara tenang, bayangkan praketknya nanti bisa menimbulkan ruang intervensi langsung dan tidak langsung,"" katanya.",praketknya,prakteknya
"Denpasar (ANTARA News) - Lembaga Pemasyarakatan Kelas II-A Denpasar mengamanankan narapidana pengambil video terpidana mati asal Australia, Andrew Chan dan Myuran Sukumaran atau dikenal dengan kelompok ""Bali Nine"" yang beredar luas di salah satu televisi swasta.",mengamanankan,mengamankan
"Sumirat menjelaskan, yang dimaksud terorisme narkotika ialah tindakan terorisem yang dibiayai oleh hasil dari kegiatan penjualan narkotika.",terorisem,terorisme
Indonesia kini memang sudah diperbolehkan berkiprah pada kkaga internasional.,kkaga,laga
"""Atas permintaan terdakwa II (Evy) dimaksud Rio menyampaukan akan menjalin komunikasi dengan Kejaksan Agung setah kembaki dari umroh dan juga menyampaikan kepada terdakwa II bahwa semenjak islah, semua pihak menjadi cooling down,"" kata jaksa.",setah,setelah
"Selain merebut tiket menuju panggung tingkat nasional juga juara satu berhak atas hadiah uang sebesar Rp5 juta, juara dua meraup hadiah Rp3 juta, juara tiga kebagian Rp2,5 juta serta juara harapan I dan harapan II masing-masing keciprat Rp1 juta.",keciprat,kecipratan
"ROMA, KOMPAS.com - Pasangan Italia yang diculik di Mauritania, Desember tahun lalu, telah dibebaskan di Mali dan diserahkan kepada pemerintah negara itu, Menlu Italia Franco Fratttini mengatakan dalam pernyataannya, Jumat.",Fratttini,Fratini
"Lisabon (ANTARA News) - Baik Carlo Ancelotti yang kenyang pengalaman sebagai pelatih bertangan dingin, maupun Diego Simeone yang dipuji sebagai pelatih berjuluk ""dewa"" di tengah para pemainnya, sama-sama mahfum bahwa pertimbangan psikologis kerapkali mempengeharuhi kemenangan sebuah tim menghadapi laga krusial sekelas final Liga Champions.",mempengeharuhi,mempengaruhi
"''Ini merupakan bagian antisipasi, karena diduga adanya keterliban banyak pelajar dalam geng motor,'' ujar Fahmi yang sebelumnya sempat menjadi anggota DPRD Kota Sukabumi dua periode.",keterliban,keterlibatan
Baliscan mengatakan bahwa daerah selatan--yang kini hancur karena konflik selama beberapa dekade--mempunyai potensi untuk menjadi pemicu pertumbunuhan ekonomi karena kesuburan tanah dan kandungan mineralnya.,pertumbunuhan,pertumbuhan
"Sekali lagi ini sama sekali bukan kebijakan KPK tapi bersifat teknis dari Ditjen Pemasyarakatan dan tentunya pelaksanananya disesuaikan dengan kondisi masing-masing ruang tahanan,"" jelas Ruki.",pelaksanananya,pelaksanaannya
"Manajamen maskapai tidak ada penambahan pesawat menjelang hari raya Imelk tersebut, namun mempreksi setiap kursi full terjual yaitu seluruh 120 kursi semuanya terisi.",mempreksi,memprediksi
Siswa Korsel-petani Merbabu pentaskan tari soreng di FLG,soreng,seorang
"""Kami akan gelar menyiram toilet bersama setiap Senin untuk mendorong semua kotoran yang terkumpul di slauran-saluran air,"" kata Walikota Bulawayo Thaba Moyo.",slauran-saluran,saluran-saluran
"""Diperkirakan, jumlah penumpang datang ini masih akan terus membeludak hingga H-1 Lebaran,"" ujarnya.",membelud,membeludak
"Dia mengatakan, tim Badan Penanggulangan Bencana Daerah (BPBD) Matra yang tiba dilokasi kejadian, mencoba menarik perahu kepinggir pantai namun juga kesulitan karena slingnya rusak sehingga memgakibatkan proses evakuasi menjadi lambat.",slingnya,seringnya
"""Mengingat khilafah ISIS menyusut dan semakin jelas kini bahwa proyek pemerintahan mereka gagal, telah membuat kelompok ini mereprioritasi gerilya,"" kata Columb Strack dari IHS.",mereprioritasi,memprioritasi
"Dengan demikian, unggulna keenam ini maju ke semifinal untuk bertemu pemenang antara unggulan utama Novak Djokovic dengan pemain Belanda Robin Haase.",unggulna,unggulan
"Malang, Jawa Timur (ANTARA News) - Ahli konstruksi jembatan Universitas Brawijaya, Malang, Prof Dr Sri Murni Dewi, menyatakan, Jembatan Soekarno-Hatta yang kondisinya dinilai sudah membayahakan masih bisa diselamatkan dengan cara memperbaiki pengikatnya.",membayahakan,membahayakan
Ketentuan mengenai orang asing dapat menghuni atau menempati rumah dengan cara hak sewa atau hak pakai juga harus sesuai ketentuan peraturang perundang-undangan.si,perundang-undangan.si,perundang-undangan.
"Selain itu, muncul pula kekhawatiran bagaimana jika saat hasil karya atau penelitian dia jukan, invonasi mereka justru dijiplak pihak lain.",invonasi,innovasi
"Di Banyuwangi  Kota sedikitnya ada delapan  gereja, yakni Gereja Maria Kota Damai di Jalan Jaksa Agung, Gereja Huriah Kristen Batak Protestan di Jalan Ngurah Rai, Gereja Bethesda di Jalan Ikan Wader, Gereja Btehel Indonesia dan Gereja Kristen di Jalan Ikan Cakalang, Gereja Kristus Ajaib dan  Gereja Heramel Ajaib di Jalan Dr Sutomo, serta Gereja Balai Keselamatan Perjanjian.",Btehel,Bethel
Aceh lama 1 merupakan seknario yang memadukan antara varian sistem ekonomi yang pro rakyat dengan situasi perdamaian yang gagal.,seknario,skenario
istirahtanya nada vagal (yang bisa digunakan untuk menilai tingkat,istirahtanya,istirahatnya
"Saat menyampaikan dukungan itu tampak hadir tokoh besar NU seperti KH Ahmad Subadar (pimpinan Pondok Pesantren Roudlotul Ulum Besuk Pasuruan), KH Miftahul Ahyar (pimpinan Pondok Pesantren Miftahussunah Surabaya sekaligus Rois Suriah PWNU Jawa Timur), KH Nasrudin (pimpinan Pondok Pesantren Senori Tuban Jawa Timur).",Miftahussunah,Miftachussunnah
"Untuk memodifikasi halaman web, konten traksasi di web, dan tak terlihat oleh pengguna maupun aplikasi web yang diakses.2.",traksasi,transaksi
Pihaknya juga mengapresiasi langkah Kementerian Pertanian dan sudah banyak memberikan bantuan ke daerah serta membuat berbagai regulasi dalam upaya mempercepat upaya khusus swasembada padi jagung dan kedelelai (Pajale).,kedelelai,kedelai
"Selanjutnya, kata Ahmat Yani tim eskpedisi Mapala UI akan berada dan menjalajahi TNLL sampai pada 02 Maret 2014.",eskpedisi,ekspedisi
"Kehadira Danial di Makassar untuk memanfaatkan hari libur berkumpul bersama keluarga di kota berjulukan ""anging mammiri"" ini.",Kehadira,kehadiran
"Dari dua sesi yang ada pada acara, Presiden Jokowi dinaubatkan menjadi pembicara utama dalam sesi pertama, yakni pembahasan mengenai stabilitas dan kesejahteraan Asia.",dinaubatkan,dinobatkan
"Alhasil, 7 orang anggota DPRD terpaksa ikut bersama ratusan pendemo menelusuri jejak-jeka patok (yang sudah dicabut) disemak-semak tapal batas lahan yang disengketakan.",jejak-jeka,jejak-jejak
"""Lama-lama akan terjadi kerusakan syaraf neuropatik diabetik dan kerusakan pembuluh darah,"" katanya.",neuropatik,neuropathic
Atraksi itu diperagakan usai upacara yang dipimpin Komandan Lantamal  Manadao Laksamana Pertama TNI Manahan Simorangkir.,Manadao,manado
"Bupati Nadalsyah mengatakan Rasulullah SAW hadir di muka Bumi adalah untuk menyempurnakan akhlak manusia, agar bertaqwa kepada Allah SWT serta berlaku baik kepada sesama manusia dan mahluk-mahluk ciptaan-nya.",mahluk-mahluk,makhluk-makhluk
"""Para guru ditakut-takuti kalau tidak meniyapkan proposal PTK bisa tidak lulus PLPG.",meniyapkan,menyiapkan
Tambahan satu poin ini membawa The Blues naik satu tingkat ke posisi 14 dengan 15 poin sementara Tottenham Hotspur di peirngkat lima dengan 25 poin dari 14 laga.,peirngkat,peringkat
"Selain dihadiri anggota APEC, pertemuan juga dihadiri Direktur Jenderal Organisasi Perdagangan Dunia (WTO), Ketua APEC Business Adviroy Council (ABAC), Sekretaris Jenderal ASEAN, ketua bersama Dewan Kerja Sama Ekonomi PAsifik (PECC), perwakilan Pacific Islands Forum (PIF) dan Melanesian Sprearhead Group (MSG).",Adviroy,Advisory
"Sementara itu, menjelang pemindahan kedua napi tersebut LP Krobokan tidak menambah pengamanan.",Krobokan,kerobokan
"Beberapa yang harus diingat jemaah haji, kata Nila, seperti mnejalankan perilaku hidup sehat dan tidak terlalu dekat dengan unta karena berpotensi menjadi perantara penyebar MERS-CoV.",mnejalankan,menjalankan
Puluihan buruh bersihkan sampah di kawasan industri Bandung timur,Puluihan,puluhan
"Harus mensosialisakan diri,"" pesan SBY.",mensosialisakan,mensosialisasikan
Namun Indonesia dan Malaysia tetap membutuhkan bantuan intrenasional untuk menaungi para imigran tersebut.,intrenasional,internasional
"Selain itu, Jalan Sulawesi, Jalan Irian dan sejumlah jalan di kawasan peciann juga terendam air.",peciann,pecinan
Jowoki petuahi bos RSUD Tarakan,Jowoki,Jokowi
"JAKARTA, KOMPAS.com - Direktur Eksekutif Indikator Politik Indonesia Burhanuddin Muhtadi mengatakan, kehadiran Raja Dangdut Rhoma Irama sebagai kandidat calon presiden (capres) Partai Kebangkitan Bangsa (PKB) belum memperlihatkan kenaikan elektabitas PKB.",elektabitas,elektabilitas
Blak-blakan saja saya baru tahu tentang kehebatan beliau itu minggu lalu.,Blak-blakan,blakblakan
"Biasanya diwujudkan secara ragawiah dengan ketaatan diri pada apa yang menjadi ketentuan alam; ketentuan air, ketentuan angin, ketentuan matahari, dan ketentuan tanah yang bermuara pada puseur atau pusat dari seluruh ketentuan atas kehendak Hyang Tunggal.",ragawiah,ragawi
Sementara itu Thailand berhasil melomta ke peringkat puncak peroelhan medali dengan menggeser tuan rumah Myanmar.,melomta,melompat
"Kegiatan workshop tersebut dilaksanakan Biro Pemerintahan dan Humas Setda Provinsi Sulut dengan mengusung tema ""Sulut Siap Bangun Kemaritiman Nasoinal Menuju Pintu Gerbang Asia pasifik"", dihadiri para birokrat dan akademisi.",Nasoinal,Nasional
"Kedua dilaksankaan keesokan harinya, yakni Minggu, 28 Oktober 1928, di Gedung Oost-Java Bioscoop dan dilanjutkan malamnya di Gedung Indonesisch Huis Kramat.",dilaksankaan,dilaksanakan
Karakter utama yang  menurut responden harus dipunyai oleh  pemimpin adalah ketegas- an dalam  menegakkan hukum.,ketegas-,ketegasan
"Setelah beberapa berunj uk rasa mengerahkan ribuan orang ke kantor DPR Kabupaten Aceh Tengah dan KIP Aceh Tengah, sembilan pasangan tersebut menggugat KIP Aceh Tengah ke MK.",berunj,berunjuk
"Akibatnya, saluran air dari laut menuju tambak tertutup  pasir, sehingga tambak tidak dapat difungsikan.",difungsik,difungsikan
"Qatar berpenduk 1,8 juta jiwa dengan penduduk asli berkisar 350 ribu orang, selebihnya mewakili kaum imigran seperti India, Pakistan, Asia, dan Afrika.",berpenduk,berpenduduk
"PLN direncanakan menggunakan gas dari lapangan Glagah Kambuna untuk ke pentingan pembangkit listriknya di Belawan, sedangkan PT Pertiwi menjadi distributor untuk konsumen gas kalangan industri di Kawasan Industri Medan (KIM).",pentingan,kepentingan
"""Mengingat ekonomi sekarang yang sulit perlu ditekankan bgaaimana menangani masalah-masalah jangka pendek, yaitu bagaimana memperkuat daya beli masyarakat, terutama masyarakat menengah ke bawah,"" kata Iwan Jaya Aziz saat konferensi pers usai bertemu Presiden.",bgaaimana,bagaimana
"Harapan kami paling tidak anak kami bisa ditampung dulu,"" kata Yosef Nurdin , di tempat penampungan, di kantor dinas sosial tenaga kerja dan transmigrasi Sikka.",igrasi,imigrasi
"Salah seorang pendiri Ikatan Wanita Pengusaha Indonesia (IWAPI) itu juga sangat aktif dalam kegiatan Anugerah Jurnalistik Adinegoro yang setiap tahun diselenggarakan PWI Pusat untuk mengenang sekaligus meneruskan semangat Adinegoro sebagai wartawan multitalenta, juga sebagai kartograf (pembuat peta), penulis cerpen dan novel, serta pendiri Radio Republik Indonesia (RRI) di Bukitinggi.",kartograf,kartograph
Pascal WERHLEIN (Jeman) Manor,,21
"Hanya saja, politikus Partai Demokrat yang juga adik ipar Susilo Bambang Yudhoyono (SBY itu enggan mengomentari anggaran pengadaan kasur yang emncapai Rp 12,45 miliar.",emncapai,mencapai
Jakarta - Badan Pemeriksa Keuangan (BPK) akhirnya menyerahkan Laporan Hasil Pemeriksaan (LHP) atas audit invetsigasi proyek Hambalang di Kemenpora.,invetsigasi,investigasi
Huawei hadrikan smartwatch berlapis emas,hadrikan,hadirkan
Kemenangan Barruichelloo ini sekaligus mempertipis jarak antara kedua pebalap Brawn GP ini.,Barruichelloo,Barrichello
"Dalam kunjungnanya itu, menteri menyerahkan bantuan dari Kementerian Perdagangan bagi para pengungsi di wilayah Banjir Baleendah, Dayeuhkolot dan Bojongsoang berupa selimut, bahan makanan, susu dan beberapa kebutuhan pengungsi lainnya.",kunjungnanya,kunjungannya
Bupati Kabupaten Administri Kepulauan Seribu Achmad Lutfi tampak hadir menyambut ratusan anggota Partai Demokrat yang tergabung dalam rombongan tersebut.,Administri,Administrasi
"""Dari investor, surat berharga berdoniminasi valas juga terus naik,"" ucapnya.",berdoniminasi,berdominasi
KOMPAS.com - Perusahaan-perusahaan penerbangan dan kapal di seluruh dunia menawarkan pengembalian uang (refund) bagi wanita hamil yang dijadwalkan mengunjungi negara-ngeara yang terpapar virus zika.,negara-ngeara,negara-negara
"Partai keempat ganda putri menjadi partai yang menegangkan bagi kedua tim, dan Tiongkok hanya memerlukan menang di ganda putri itu untuk memastikan melaju ke final..",final..,final
"Untuk itu, pihak stasiun pengisian dan pengangkutan bulk elpiji (SPBE) lebih teliti memeriksa tiap tabung yang keluar dan masuk, dangn harapan bisa mengurangi risiko kecelakaan akibat tabung rusak.",dangn,dengan
Saat itu Arvin hanya finis pada urutaab kedua di bawah Amir Zargari.,urutaab,urutan
"Berkaitan dengan listrik, Alfado Kasroh membuat teknologi yang memungkinkan manusia dapat mematikan dan menyalakan listrik gedung hanya dengan SMS.",Alfado,Alfredo
